{"schema":"ev4-builder-resume-authorization@1.0.0","status":"accepted","session_id":"BSESSION-001","canonical_package_digest":"bbbbbbbbbbbbbbbbbbbbbbbbbbbbbbbbbbbbbbbbbbbbbbbbbbbbbbbbbbbbbbbb","selected_candidate_id":"CANDIDATE-001","resume_workflow_mode":"APPROVED_HANDOFF_MODE","resume_runtime_state":"BUILD_ACTIVE","source_state_capsule_sha256":"cccccccccccccccccccccccccccccccccccccccccccccccccccccccccccccccc","blocking_diagnostics":[],"production_ready":false}
